{"boundaries":[{"afterTransition":"command-durable","applicableEffects":["not-applied"],"beforeTransition":"connection-reread","counterAssertions":["no-provider-call","reservation-released-after-recovery","reservation-written","sealed-command-durable","stable-operation-id"],"crashScenarioId":"crash-after-command","failpoint":"after-command","providerTruthRequired":true,"recoveryCall":"recover"},{"afterTransition":"decision-durable","applicableEffects":["not-applied"],"beforeTransition":"reservation-durable","counterAssertions":["decision-receipt-durable","no-provider-call","stable-operation-id"],"crashScenarioId":"crash-after-decision","failpoint":"after-decision","providerTruthRequired":true,"recoveryCall":"recover"},{"afterTransition":"provider-entry-durable","applicableEffects":["not-applied"],"beforeTransition":"provider-request-written","counterAssertions":["no-provider-call","provider-entry-once","reservation-released-after-recovery","reservation-written","stable-operation-id"],"crashScenarioId":"crash-after-entry-marker","failpoint":"after-entry-marker","providerTruthRequired":true,"recoveryCall":"recover"},{"afterTransition":"execution-receipt-durable","applicableEffects":["applied","not-applied"],"beforeTransition":"terminal-durable","counterAssertions":["execution-receipt-durable","no-second-provider-call","receipt-not-reminted","stable-operation-id"],"crashScenarioId":"crash-after-execution-receipt","failpoint":"after-execution-receipt","providerTruthRequired":true,"recoveryCall":"recover"},{"afterTransition":"credential-lease-succeeded","applicableEffects":["not-applied"],"beforeTransition":"provider-entry-durable","counterAssertions":["credential-lease-closed","credential-lease-once","no-provider-call","reservation-released-after-recovery","reservation-written","stable-operation-id"],"crashScenarioId":"crash-after-lease","failpoint":"after-lease","providerTruthRequired":true,"recoveryCall":"recover"},{"afterTransition":"observation-durable","applicableEffects":["applied","not-applied"],"beforeTransition":"execution-receipt-durable","counterAssertions":["no-second-provider-call","observation-durable","stable-operation-id"],"crashScenarioId":"crash-after-observation","failpoint":"after-observation","providerTruthRequired":true,"recoveryCall":"recover"},{"afterTransition":"provider-result-durable","applicableEffects":["applied","not-applied"],"beforeTransition":"observation-durable","counterAssertions":["no-second-provider-call","provider-result-durable","stable-operation-id"],"crashScenarioId":"crash-after-provider-result","failpoint":"after-provider-result","providerTruthRequired":true,"recoveryCall":"recover"},{"afterTransition":"provider-request-written","applicableEffects":["applied","not-applied"],"beforeTransition":"provider-response-observed","counterAssertions":["no-second-provider-call","provider-request-write-once","stable-operation-id"],"crashScenarioId":"crash-after-request-write","failpoint":"after-request-write","providerTruthRequired":true,"recoveryCall":"recover"},{"afterTransition":"connection-reread","applicableEffects":["not-applied"],"beforeTransition":"credential-lease-attempted","counterAssertions":["connection-reread-once","no-provider-call","reservation-released-after-recovery","reservation-written","stable-operation-id"],"crashScenarioId":"crash-after-reread","failpoint":"after-reread","providerTruthRequired":true,"recoveryCall":"recover"},{"afterTransition":"reservation-durable","applicableEffects":["not-applied"],"beforeTransition":"command-durable","counterAssertions":["no-provider-call","reservation-released-after-recovery","reservation-written","stable-operation-id"],"crashScenarioId":"crash-after-reservation","failpoint":"after-reservation","providerTruthRequired":true,"recoveryCall":"recover"},{"afterTransition":"terminal-durable","applicableEffects":["applied","not-applied"],"beforeTransition":"response-projected","counterAssertions":["no-second-provider-call","stable-operation-id","terminal-durable"],"crashScenarioId":"crash-after-terminal","failpoint":"after-terminal","providerTruthRequired":true,"recoveryCall":"status"},{"afterTransition":"request-received","applicableEffects":["not-applied"],"beforeTransition":"decision-durable","counterAssertions":["no-provider-call"],"crashScenarioId":"crash-before-decision","failpoint":"before-decision","providerTruthRequired":true,"recoveryCall":"retry-original"}],"domain":"stripe","providerTruthFields":["accountSha256","amount","applied","competingRefundCount","currency","paymentIntentSha256","refundSha256","unrelatedRefundCount"],"schema":"auths.profile-qualification-failpoint-coverage/1"}
